{
  "published_at": "2026-10-15T17:51:21Z",
  "prev_published_at": "2026-10-15T17:24:38Z",
  "headline": [
    {
      "key": "gauge",
      "label": "Macrogauge (CPI-comparable)",
      "kind": "gauge",
      "value": 3.28,
      "as_of": "2026-10-15",
      "prev_value": 3.28,
      "prev_as_of": "2026-10-15",
      "delta_pp": 0.0
    },
    {
      "key": "tracker",
      "label": "CPI-Tracker",
      "kind": "gauge",
      "value": 3.84,
      "as_of": "2026-10-15",
      "prev_value": 3.84,
      "prev_as_of": "2026-10-15",
      "delta_pp": 0.0
    },
    {
      "key": "col",
      "label": "Cost of Living",
      "kind": "gauge",
      "value": 5.56,
      "as_of": "2026-10-15",
      "prev_value": 5.56,
      "prev_as_of": "2026-10-15",
      "delta_pp": 0.0
    },
    {
      "key": "supercore",
      "label": "Supercore",
      "kind": "gauge",
      "value": 2.9,
      "as_of": "2026-09-01",
      "prev_value": 2.9,
      "prev_as_of": "2026-09-01",
      "delta_pp": 0.0
    },
    {
      "key": "pce",
      "label": "PCE-weighted",
      "kind": "gauge",
      "value": 3.28,
      "as_of": "2026-10-15",
      "prev_value": 3.28,
      "prev_as_of": "2026-10-15",
      "delta_pp": 0.0
    },
    {
      "key": "dc_build",
      "label": "DC Build",
      "kind": "datacenter",
      "value": 8.56,
      "as_of": "2026-10-15",
      "prev_value": 8.55,
      "prev_as_of": "2026-10-15",
      "delta_pp": 0.01
    },
    {
      "key": "dc_ops",
      "label": "DC Ops",
      "kind": "datacenter",
      "value": 5.61,
      "as_of": "2026-09-01",
      "prev_value": 5.61,
      "prev_as_of": "2026-09-01",
      "delta_pp": 0.0
    },
    {
      "key": "dc_hardware",
      "label": "DC Hardware",
      "kind": "datacenter",
      "value": 29.33,
      "as_of": "2026-09-01",
      "prev_value": 29.33,
      "prev_as_of": "2026-09-01",
      "delta_pp": 0.0
    }
  ],
  "components": [
    {
      "component": "shelter_owned",
      "label": "Shelter (owned)",
      "mode": "live",
      "yoy_pct": 1.52,
      "prev_yoy_pct": 1.52,
      "delta_pp": 0.0,
      "bls_yoy_pct": 3.28
    },
    {
      "component": "fuel",
      "label": "Gasoline",
      "mode": "live",
      "yoy_pct": 39.79,
      "prev_yoy_pct": 39.79,
      "delta_pp": 0.0,
      "bls_yoy_pct": 34.17
    },
    {
      "component": "shelter_rent",
      "label": "Rent",
      "mode": "live",
      "yoy_pct": 1.52,
      "prev_yoy_pct": 1.52,
      "delta_pp": 0.0,
      "bls_yoy_pct": 2.78
    },
    {
      "component": "used_vehicles",
      "label": "Used cars & trucks",
      "mode": "live",
      "yoy_pct": -1.79,
      "prev_yoy_pct": -1.79,
      "delta_pp": 0.0,
      "bls_yoy_pct": -1.46
    },
    {
      "component": "other",
      "label": "Everything else (CPI residual)",
      "mode": "bls_cf",
      "yoy_pct": 3.45,
      "prev_yoy_pct": 3.45,
      "delta_pp": 0.0,
      "bls_yoy_pct": 3.45
    },
    {
      "component": "food_home",
      "label": "Food at home",
      "mode": "bls_cf",
      "yoy_pct": 1.81,
      "prev_yoy_pct": 1.81,
      "delta_pp": 0.0,
      "bls_yoy_pct": 1.81
    },
    {
      "component": "medical",
      "label": "Medical care",
      "mode": "bls_cf",
      "yoy_pct": 1.5,
      "prev_yoy_pct": 1.5,
      "delta_pp": 0.0,
      "bls_yoy_pct": 1.5
    },
    {
      "component": "food_away",
      "label": "Food away from home",
      "mode": "bls_cf",
      "yoy_pct": 3.46,
      "prev_yoy_pct": 3.46,
      "delta_pp": 0.0,
      "bls_yoy_pct": 3.46
    },
    {
      "component": "education_comm",
      "label": "Education & comm",
      "mode": "bls_cf",
      "yoy_pct": 2.31,
      "prev_yoy_pct": 2.31,
      "delta_pp": 0.0,
      "bls_yoy_pct": 2.31
    },
    {
      "component": "recreation",
      "label": "Recreation",
      "mode": "bls_cf",
      "yoy_pct": 2.84,
      "prev_yoy_pct": 2.84,
      "delta_pp": 0.0,
      "bls_yoy_pct": 2.84
    },
    {
      "component": "new_vehicles",
      "label": "New vehicles",
      "mode": "bls_cf",
      "yoy_pct": 0.61,
      "prev_yoy_pct": 0.61,
      "delta_pp": 0.0,
      "bls_yoy_pct": 0.61
    },
    {
      "component": "electricity",
      "label": "Electricity",
      "mode": "bls_cf",
      "yoy_pct": 4.37,
      "prev_yoy_pct": 4.37,
      "delta_pp": 0.0,
      "bls_yoy_pct": 4.37
    },
    {
      "component": "apparel",
      "label": "Apparel",
      "mode": "bls_cf",
      "yoy_pct": 3.41,
      "prev_yoy_pct": 3.41,
      "delta_pp": 0.0,
      "bls_yoy_pct": 3.41
    },
    {
      "component": "nat_gas",
      "label": "Piped gas",
      "mode": "bls_cf",
      "yoy_pct": 4.97,
      "prev_yoy_pct": 4.97,
      "delta_pp": 0.0,
      "bls_yoy_pct": 4.97
    }
  ],
  "official": {
    "month": "2026-09-01",
    "yoy_pct": 3.74,
    "latest_month": "2026-09-01",
    "prev_month": "2026-09-01",
    "new_print": false
  },
  "sources_landed": [
    {
      "source": "FMP_EQ",
      "new_rows": 55
    },
    {
      "source": "FMP",
      "new_rows": 13
    },
    {
      "source": "KALSHI_FED",
      "new_rows": 4
    },
    {
      "source": "OPENROUTER",
      "new_rows": 2
    },
    {
      "source": "VASTAI",
      "new_rows": 2
    },
    {
      "source": "ERCOT",
      "new_rows": 1
    },
    {
      "source": "KALSHI",
      "new_rows": 1
    }
  ],
  "sources_failed": [],
  "gate_holds": [],
  "movers": [
    {
      "key": "hub_ercot_north_da",
      "label": "ERCOT North Hub 30-day average",
      "section": "AI Infra",
      "kind": "level",
      "unit": "$/MWh",
      "notable": 3.0,
      "href": "/power",
      "value": 40.46,
      "as_of": "2026-10-16",
      "prev_value": 41.22,
      "prev_as_of": "2026-10-15",
      "delta": -1.84,
      "delta_unit": "%",
      "significance": 0.61
    },
    {
      "key": "capacity_ev",
      "label": "Priced neocloud enterprise value",
      "section": "AI Infra",
      "kind": "level",
      "unit": "$B",
      "notable": 3.0,
      "href": "/capacity",
      "value": 211.8,
      "as_of": "2026-10-15",
      "prev_value": 210.2,
      "prev_as_of": "2026-10-15",
      "delta": 0.76,
      "delta_unit": "%",
      "significance": 0.25
    },
    {
      "key": "compute_token_index",
      "label": "Token price index",
      "section": "AI Infra",
      "kind": "level",
      "unit": "index",
      "notable": 1.0,
      "href": "/compute",
      "value": 87.263,
      "as_of": "2026-10-15",
      "prev_value": 87.481,
      "prev_as_of": "2026-10-15",
      "delta": -0.25,
      "delta_unit": "%",
      "significance": 0.25
    },
    {
      "key": "compute_gpu_index",
      "label": "GPU-hour index",
      "section": "AI Infra",
      "kind": "level",
      "unit": "index",
      "notable": 1.0,
      "href": "/compute",
      "value": 109.494,
      "as_of": "2026-10-15",
      "prev_value": 109.654,
      "prev_as_of": "2026-10-15",
      "delta": -0.15,
      "delta_unit": "%",
      "significance": 0.15
    },
    {
      "key": "dc_build",
      "label": "DC Build index YoY",
      "section": "AI Infra",
      "kind": "yoy",
      "unit": "%",
      "notable": 0.1,
      "href": "/datacenter",
      "value": 8.56,
      "as_of": "2026-10-15",
      "prev_value": 8.55,
      "prev_as_of": "2026-10-15",
      "delta": 0.01,
      "delta_unit": "pp",
      "significance": 0.1
    },
    {
      "key": "copper",
      "label": "Copper front month",
      "section": "AI Infra",
      "kind": "level",
      "unit": "$/lb",
      "notable": 2.0,
      "href": "/commodities",
      "value": 6.5588,
      "as_of": "2026-10-15",
      "prev_value": 6.5533,
      "prev_as_of": "2026-10-15",
      "delta": 0.08,
      "delta_unit": "%",
      "significance": 0.04
    },
    {
      "key": "capacity_op_mw",
      "label": "Tracked operational AI capacity",
      "section": "AI Infra",
      "kind": "level",
      "unit": "MW",
      "notable": 0.5,
      "href": "/capacity",
      "value": 41475.5,
      "as_of": "2026-10-02",
      "prev_value": 41475.5,
      "prev_as_of": "2026-10-02",
      "delta": 0.0,
      "delta_unit": "%",
      "significance": 0.0
    },
    {
      "key": "dc_hardware",
      "label": "DC Hardware index YoY",
      "section": "AI Infra",
      "kind": "yoy",
      "unit": "%",
      "notable": 0.1,
      "href": "/datacenter",
      "value": 29.33,
      "as_of": "2026-09-01",
      "prev_value": 29.33,
      "prev_as_of": "2026-09-01",
      "delta": 0.0,
      "delta_unit": "pp",
      "significance": 0.0
    },
    {
      "key": "dc_ops",
      "label": "DC Ops index YoY",
      "section": "AI Infra",
      "kind": "yoy",
      "unit": "%",
      "notable": 0.1,
      "href": "/datacenter",
      "value": 5.61,
      "as_of": "2026-09-01",
      "prev_value": 5.61,
      "prev_as_of": "2026-09-01",
      "delta": 0.0,
      "delta_unit": "pp",
      "significance": 0.0
    },
    {
      "key": "gauge_col",
      "label": "Cost of Living YoY",
      "section": "Inflation",
      "kind": "yoy",
      "unit": "%",
      "notable": 0.05,
      "href": "/gap",
      "value": 5.56,
      "as_of": "2026-10-15",
      "prev_value": 5.56,
      "prev_as_of": "2026-10-15",
      "delta": 0.0,
      "delta_unit": "pp",
      "significance": 0.0
    },
    {
      "key": "gauge_gauge",
      "label": "Macrogauge (CPI-comparable) YoY",
      "section": "Inflation",
      "kind": "yoy",
      "unit": "%",
      "notable": 0.05,
      "href": "/",
      "value": 3.28,
      "as_of": "2026-10-15",
      "prev_value": 3.28,
      "prev_as_of": "2026-10-15",
      "delta": 0.0,
      "delta_unit": "pp",
      "significance": 0.0
    },
    {
      "key": "gauge_pce",
      "label": "PCE-weighted YoY",
      "section": "Inflation",
      "kind": "yoy",
      "unit": "%",
      "notable": 0.05,
      "href": "/gap",
      "value": 3.28,
      "as_of": "2026-10-15",
      "prev_value": 3.28,
      "prev_as_of": "2026-10-15",
      "delta": 0.0,